Title,Link,Details
Isaac Newton - Wikipedia,https://en.wikipedia.org/wiki/Isaac_Newton,"Sir Isaac Newton PRS (25 December 1642 – 20 March 1726/27) was an English mathematician, physicist, astronomer, alchemist, theologian, and author widely ..."
"Isaac Newton | Biography, Facts, Discoveries, Laws ...",https://www.britannica.com/biography/Isaac-Newton,"Isaac Newton, in full Sir Isaac Newton, (born December 25, 1642 [January 4, 1643, New Style], Woolsthorpe, Lincolnshire, England—died March 20 [March 31], ..."
Isaac Newton (Stanford Encyclopedia of Philosophy),https://plato.stanford.edu/entries/newton/,"by G Smith · 2007 · Cited by 11 — In mathematics, Newton was the first to develop a full range of algorithms for symbolically determining what we now call integrals and ..."
Isaac Newton (1643 - 1727) - Biography,https://mathshistory.st-andrews.ac.uk/Biographies/Newton/,Isaac Newton was the greatest English mathematician of his generation. He laid the foundation for differential and integral calculus. His work on optics and ...
"Isaac Newton - Quotes, Facts & Laws - Biography (Bio.)",https://www.biography.com/scientist/isaac-newton,"Apr 27, 2017 — Isaac Newton was a physicist and mathematician who developed the principles of modern physics, including the laws of motion and is credited ..."
"Sir Isaac Newton: Quotes, facts & biography - Space.com",https://www.space.com/15898-isaac-newton.html,"Jan 25, 2022 — Sir Isaac Newton contributed significantly to the field of science over his lifetime. He invented calculus (opens in new tab) and provided a ..."
Lionel Messi - Wikipedia,https://en.wikipedia.org/wiki/Lionel_Messi,"24 minutes ago — Lionel Andrés Messi also known as Leo Messi, is an Argentine professional footballer who plays as a forward for Ligue 1 club Paris Saint-Germain and ..."
Leo Messi (@leomessi) • Instagram photos and videos,https://www.instagram.com/leomessi/?hl=en,"335m Followers, 294 Following, 867 Posts - See Instagram photos and videos from Leo Messi (@leomessi)"
Lionel Messi - Player profile 21/22 | Transfermarkt,https://www.transfermarkt.com/lionel-messi/profil/spieler/28003,"#30 Lionel Messi ; Height: 1,70 m ; Position: Right Winger ; Current international: Argentina ; Appearances. 26 ; Goals. 6."
Lionel Messi 33 Crazy Dribbling Skills for PSG - YouTube,https://www.youtube.com/watch?v=W-SIYTANgmA,"#30 Lionel Messi ; Height: 1,70 m ; Position: Right Winger ; Current international: Argentina ; Appearances. 26 ; Goals. 6."
"Lionel Messi | Biography, Team, Barcelona, PSG, & Facts",https://www.britannica.com/biography/Lionel-Messi,"Lionel Messi, in full Lionel Andrés Messi, also called Leo Messi, (born June 24, 1987, Rosario, Argentina), Argentine-born football (soccer) player who was ..."
Lionel Messi - Official Website of FC Barcelona,https://www.fcbarcelona.com/en/football/first-team/players/4974/lionel-messi,My shirt. Forward. 30 Lionel Messi. Facebook Instagram Website. Barça Appearances. 778. 2021/2022 Season. 0. Barça Goals. 672. 2021/2022 Season.
Lionel Messi - Forbes,https://www.forbes.com/profile/lionel-messi/,1 Lionel Messi on the 2022 The World's Highest-Paid Athletes - Messi claimed the Ballon d'Or as the world's best soccer player for a record seventh time in ...
Web oficial Leo Messi jugador del PSG,https://messi.com/en/,"Web oficial de Lionel Messi, jugador del Futbol Club Barcelona hasta la temporada 2020-2021 y jugador del PSG en la temporada 2021-2022."
Welcome to Python.org,https://www.python.org/,The official home of the Python Programming Language.
Python Tutorial - W3Schools,https://www.w3schools.com/python/,Python is a popular programming language. Python can be used on a server to create web applications. Start learning Python now » ...
Python (programming language) - Wikipedia,http://en.wikipedia.org/wiki/Python_Software_Foundation,"Python is a high-level, interpreted, general-purpose programming language. Its design philosophy emphasizes code readability with the use of significant ..."
Learn Python Programming - Programiz,https://www.programiz.com/python-programming,"Python is a powerful general-purpose programming language. It is used in web development, data science, creating software prototypes, and so on."
Python Courses & Tutorials - Codecademy,https://www.codecademy.com/catalog/language/python,"Python is a general-purpose, versatile, and powerful programming language. It's a great first language because it's concise and easy to read."
"Acer United States | Laptops, Desktops, Chromebooks ...",https://www.acer.com/ac/en/US/content/home,Predator Triton 500 · Acer Chromebook Spin 311 · Aspire 5 · Swift X · Windows 11 · Xbox Game Pass · Acer Corner · Intel® Extreme Masters.
"US | Laptops, Desktops, Chromebooks, Monitors and more!",https://store.acer.com/en-us/,"Acer Store - US | Save now on the latest Acer products - Laptops, Chromebooks, Desktops, Monitors and so much more. Shop Now."
Acer Store,https://store.acer.com/en-sg/,ACER - explore beyond limits. America. Brazil. Brazilian Portuguese · Canada. English · Canada. French · United States. English. Europe.
"Laptops, PCs, Tablets, Monitors & more! - Acer Store",https://store.acer.com/en-in/,"Shop for the best Acer thin and light laptops, gaming laptops, business laptops, PCs, tablets, monitors, accessories & more."
"Acer Store UK | Laptops, Desktops, Chromebooks, Monitors ...",https://store.acer.com/en-gb/,"Explore the Official Acer Store UK and shop the newest Acer notebooks, 2-in-1s, chromebooks, desktops, monitors, projectors, and accessories. Free delivery."
Acer Inc. - Wikipedia,https://en.wikipedia.org/wiki/Acer_Inc.,"Acer Inc is a Taiwanese multinational hardware and electronics corporation specializing in advanced electronics technology, headquartered in Xizhi, ..."
"Acer Laptops Price in India, Reviews, Specifications - NDTV ...",https://gadgets360.com/laptops/acer-laptops,Acer is a Taiwanese multinational company that is in the hardware and electronics business. Acer was founded as Multitech in 1976 and renamed Acer in 1987.
